<!--
  ~ Copyright 2024 Oracle and/or its affiliates
  ~
  ~ Licensed under the Apache License, Version 2.0 (the "License");
  ~ you may not use this file except in compliance with the License.
  ~ You may obtain a copy of the License at
  ~
  ~ https://www.apache.org/licenses/LICENSE-2.0
  ~
  ~ Unless required by applicable law or agreed to in writing, software
  ~ distributed under the License is distributed on an "AS IS" BASIS,
  ~ WITHOUT WARRANTIES OR CONDITIONS OF ANY KIND, either express or implied.
  ~ See the License for the specific language governing permissions and
  ~ limitations under the License.
  -->

<!DOCTYPE data-dictionary SYSTEM "../statement-interface.dtd">
<data-dictionary>
    <statement-execution-processor id="schemas">
        <statement>
            select * from PRAGMA_DATABASE_LIST where FILE is not null and length(FILE) > 0
        </statement>
        <statement>
            pragma database_list
        </statement>
    </statement-execution-processor>

    <statement-execution-processor id="users">
        <statement>
        </statement>
    </statement-execution-processor>

    <statement-execution-processor id="tables">
        <statement>
            select
                NAME as TABLE_NAME,
                'N' as IS_TEMPORARY,
                NULL as COMMENTS
            from {@0}.SQLITE_MASTER
            where
                TYPE = 'table'
            order by TABLE_NAME asc
        </statement>
    </statement-execution-processor>

    <statement-execution-processor id="views">
        <statement>
            select
                NAME as VIEW_NAME,
                null as VIEW_TYPE_OWNER,
                null as VIEW_TYPE,
                'N' as IS_SYSTEM_VIEW,
                'N' as IS_EDITIONABLE,
                NULL as COMMENTS
            from {@0}.SQLITE_MASTER
            where
                TYPE = 'view'
            order by VIEW_NAME asc
        </statement>
    </statement-execution-processor>
    <statement-execution-processor id="dataset-names">
        <statement>
            select
                NAME as DATASET_NAME
            from {@0}.SQLITE_MASTER
            where
                TYPE = 'table' or
                TYPE = 'view'
            order by DATASET_NAME asc
        </statement>
    </statement-execution-processor>

    <statement-execution-processor id="dataset-columns">
        <statement>
            PRAGMA {@0}.TABLE_INFO({@1})
        </statement>
    </statement-execution-processor>

    <statement-execution-processor id="constraints">
        <statement>
            PRAGMA {@0}.INDEX_LIST({@1})
        </statement>
    </statement-execution-processor>

    <statement-execution-processor id="foreign-key-constraints">
        <statement>
            PRAGMA {@0}.FOREIGN_KEY_LIST({@1})
        </statement>
    </statement-execution-processor>

    <statement-execution-processor id="indexes">
        <statement>
            PRAGMA {@0}.INDEX_LIST({@1})
        </statement>
    </statement-execution-processor>

    <statement-execution-processor id="index-info">
        <statement>
            PRAGMA {@0}.INDEX_XINFO({@1})
        </statement>
    </statement-execution-processor>

    <statement-execution-processor id="dataset-triggers">
        <statement>
            select NAME as TRIGGER_NAME,
                   TBL_NAME as DATASET_NAME,
                   '' as TRIGGER_TYPE,
                   '' as TRIGGERING_EVENT,
                   'TABLE' as TRIGGER_TARGET,
                   null as TARGET_SCHEMA_NAME,
                   null as TRIGGER_FUNCTION_NAME,
                   null as TRIGGER_FUNCTION_SCHEMA_NAME,
                   'N' as IS_DISABLED,
                   'Y' as IS_VALID,
                   'N' as IS_DEBUG,
                   'Y' as IS_FOR_EACH_ROW,
                   SQL as SOURCE_CODE
              from {@0}.SQLITE_MASTER
             where TYPE = 'trigger'
               and TBL_NAME = {#1}
             order by TRIGGER_NAME asc
        </statement>
    </statement-execution-processor>

    <statement-execution-processor id="all-dataset-triggers">
        <statement>
            select NAME as TRIGGER_NAME,
                   TBL_NAME as DATASET_NAME,
                   '' as TRIGGER_TYPE,
                   '' as TRIGGERING_EVENT,
                   'TABLE' as TRIGGER_TARGET,
                   null as TARGET_SCHEMA_NAME,
                   null as TRIGGER_FUNCTION_NAME,
                   null as TRIGGER_FUNCTION_SCHEMA_NAME,
                   'N' as IS_DISABLED,
                   'Y' as IS_VALID,
                   'N' as IS_DEBUG,
                   'Y' as IS_FOR_EACH_ROW,
                    SQL as SOURCE_CODE
              from {@0}.SQLITE_MASTER
             where TYPE = 'trigger'
             order by TRIGGER_NAME asc
        </statement>
    </statement-execution-processor>

    <statement-execution-processor id="view-source-code">
        <statement>
            select SQL as SOURCE_CODE
              from {@0}.SQLITE_MASTER
             where TYPE = 'view'
               and NAME = {#1}
        </statement>
    </statement-execution-processor>
    <statement-execution-processor id="dataset-trigger-source-code">
        <statement>
            select SQL as SOURCE_CODE
              from {@0}.SQLITE_MASTER
             where TYPE = 'trigger'
               and TBL_NAME = {#1}
               and NAME = {#2}
        </statement>
    </statement-execution-processor>

    <statement-execution-processor id="drop-object-if-exists">
        <statement>drop {0} if exists {@1}.{@2}</statement>
    </statement-execution-processor>

    <statement-execution-processor id="load-distinct-values">
        <statement>
            select VALUE from (
                select distinct {@2} as VALUE from {@0}.{@1} where {@2} is not null limit {3}
            ) VALUE_LIST order by VALUE
        </statement>
    </statement-execution-processor>    

    <statement-execution-processor id="validate-connection" timeout="5">
        <statement>
            select 1
        </statement>
    </statement-execution-processor>

</data-dictionary>
