<!--
  ~ Copyright 2024 Oracle and/or its affiliates
  ~
  ~ Licensed under the Apache License, Version 2.0 (the "License");
  ~ you may not use this file except in compliance with the License.
  ~ You may obtain a copy of the License at
  ~
  ~ https://www.apache.org/licenses/LICENSE-2.0
  ~
  ~ Unless required by applicable law or agreed to in writing, software
  ~ distributed under the License is distributed on an "AS IS" BASIS,
  ~ WITHOUT WARRANTIES OR CONDITIONS OF ANY KIND, either express or implied.
  ~ See the License for the specific language governing permissions and
  ~ limitations under the License.
  -->

<!DOCTYPE data-dictionary SYSTEM "../statement-interface.dtd">
<data-dictionary>
    <statement-execution-processor id="rename-table">
        <statement>alter table {@0}.{@1} rename to {@2}</statement>
    </statement-execution-processor>

    <statement-execution-processor id="rename-column">
        <statement>alter table {@0}.{@1} rename column {@2} to {@3}</statement>
    </statement-execution-processor>

    <statement-execution-processor id="rename-index">
        <statement>alter index {@0}.{@2} rename to {@3}</statement>
    </statement-execution-processor>

    <statement-execution-processor id="rename-constraint">
        <statement>alter table {@0}.{@1} rename constraint {@2} to {@3}</statement>
    </statement-execution-processor>

    <statement-execution-processor id="create-synonym">
        <statement>create synonym {@0}.{@1} for {@2}.{@3}</statement>
    </statement-execution-processor>

    <statement-execution-processor id="create-view">
        <statement>create view {0} as {1}</statement>
    </statement-execution-processor>

    <statement-execution-processor id="change-view">
        <statement>create or replace {3} view {0}.{1} as {2}</statement>
    </statement-execution-processor>

    <statement-execution-processor id="change-json-view">
        <statement>create or replace {3} json relational duality view {0}.{1} as {2}</statement>
    </statement-execution-processor>


    <statement-execution-processor id="create-object">
        <statement>create {0}</statement>
    </statement-execution-processor>

    <statement-execution-processor id="update-object">
        <statement>create or replace {0}</statement>
    </statement-execution-processor>

    <statement-execution-processor id="drop-object">
        <statement>drop {0} {1}.{2}</statement>
    </statement-execution-processor>

    <statement-execution-processor id="drop-user">
        <statement>drop user {@0} cascade</statement>
    </statement-execution-processor>

    <statement-execution-processor id="lock-user">
        <statement>alter user {@0} account lock</statement>
    </statement-execution-processor>

    <statement-execution-processor id="unlock-user">
        <statement>alter user {@0} account unlock</statement>
    </statement-execution-processor>

    <statement-execution-processor id="refresh-materialized-view">
        <statement>begin dbms_mview.refresh(list =&gt; '{@0}.{@1}'); end;</statement>
    </statement-execution-processor>

    <statement-execution-processor id="drop-constraint">
        <statement>alter table {0}.{1} drop constraint {2}</statement>
    </statement-execution-processor>

    <statement-execution-processor id="drop-object-body">
        <statement>drop {0} body {1}.{2}</statement>
    </statement-execution-processor>

    <statement-execution-processor id="compile-object">
        <statement since-version="11.1">
            alter {2} {0}.{1} compile {3} {4}
        </statement>
        <statement>
            alter {2} {0}.{1} compile {3}
        </statement>
    </statement-execution-processor>

    <statement-execution-processor id="compile-object-body">
        <statement since-version="11.1">
            alter {2} {0}.{1} compile {3} body {4}
        </statement>
        <statement>
            alter {2} {0}.{1} compile {3} body
        </statement>
    </statement-execution-processor>

    <statement-execution-processor id="extract-ddl-statement">
        <statement>
            select DBMS_METADATA.GET_DDL(
                            OBJECT_TYPE => {#0},
                            NAME        => {#2},
                            SCHEMA      => {#1}) from dual
        </statement>
    </statement-execution-processor>
</data-dictionary>
