<!--
  ~ Copyright 2024 Oracle and/or its affiliates
  ~
  ~ Licensed under the Apache License, Version 2.0 (the "License");
  ~ you may not use this file except in compliance with the License.
  ~ You may obtain a copy of the License at
  ~
  ~ https://www.apache.org/licenses/LICENSE-2.0
  ~
  ~ Unless required by applicable law or agreed to in writing, software
  ~ distributed under the License is distributed on an "AS IS" BASIS,
  ~ WITHOUT WARRANTIES OR CONDITIONS OF ANY KIND, either express or implied.
  ~ See the License for the specific language governing permissions and
  ~ limitations under the License.
  -->

<!DOCTYPE data-dictionary SYSTEM "../statement-interface.dtd">
<data-dictionary>
    <statement-execution-processor id="rename-table" transactional="true">
        <statement>alter table {@0}.{@1} rename to {@2}</statement>
    </statement-execution-processor>

    <statement-execution-processor id="rename-column" transactional="true">
        <statement>alter table {@0}.{@1} rename column {@2} to {@3}</statement>
    </statement-execution-processor>

    <statement-execution-processor id="rename-index" transactional="true">
        <statement>alter index {@0}.{@2} rename to {@3}</statement>
    </statement-execution-processor>

    <statement-execution-processor id="rename-constraint" transactional="true">
        <statement>alter table {@0}.{@1} rename constraint {@2} to {@3}</statement>
    </statement-execution-processor>

    <statement-execution-processor id="create-view" transactional="true">
        <statement>create view {0} as {1}</statement>
    </statement-execution-processor>

    <statement-execution-processor id="change-view" transactional="true">
        <statement>create or replace view {0}.{1} as {2}</statement>
    </statement-execution-processor>

    <statement-execution-processor id="refresh-materialized-view" transactional="true">
        <statement>refresh materialized view {@0}.{@1}</statement>
    </statement-execution-processor>


    <statement-execution-processor id="create-object" transactional="true">
        <statement>create {0}</statement>
    </statement-execution-processor>

    <statement-execution-processor id="create-trigger-function" transactional="true">
        <statement>
            create function {0}() returns trigger language plpgsql as $DBN_TRIGGER$
            {1}
            $DBN_TRIGGER$
        </statement>
    </statement-execution-processor>

    <statement-execution-processor id="create-event-trigger-function" transactional="true">
        <statement>
            create function {@0}.{@1}() returns event_trigger language plpgsql as $DBN_EVENT_TRIGGER$
            {2}
            $DBN_EVENT_TRIGGER$
        </statement>
    </statement-execution-processor>

    <statement-execution-processor id="update-object" transactional="true">
        <statement>create or replace {0}</statement>
    </statement-execution-processor>

    <statement-execution-processor id="update-event-trigger" transactional="true">
        <statement>create {0}</statement>
    </statement-execution-processor>

    <statement-execution-processor id="drop-object" transactional="true">
        <statement>drop {0} {1}.{2}</statement>
    </statement-execution-processor>

    <statement-execution-processor id="drop-user">
        <statement>drop user {@0}</statement>
    </statement-execution-processor>

    <statement-execution-processor id="enable-user">
        <statement>alter role {@0} login</statement>
    </statement-execution-processor>

    <statement-execution-processor id="disable-user">
        <statement>alter role {@0} nologin</statement>
    </statement-execution-processor>

    <statement-execution-processor id="drop-constraint">
        <statement>alter table {0}.{1} drop constraint {2}</statement>
    </statement-execution-processor>

    <statement-execution-processor id="drop-dataset-trigger">
        <statement>drop trigger {@2} on {@0}.{@1}</statement>
    </statement-execution-processor>

    <statement-execution-processor id="drop-event-trigger" transactional="true">
        <statement>drop event trigger if exists {0}</statement>
    </statement-execution-processor>

    <statement-execution-processor id="drop-trigger-function" transactional="true">
        <statement>drop function if exists {0}()</statement>
    </statement-execution-processor>

    <statement-execution-processor id="drop-event-trigger-function" transactional="true">
        <statement>drop function if exists {@0}.{@1}()</statement>
    </statement-execution-processor>

    <statement-execution-processor id="get-session-sql-mode">
        <statement>SELECT @@session.sql_mode</statement>
    </statement-execution-processor>

    <statement-execution-processor id="set-session-sql-mode">
        <statement>SET sql_mode='{0}'</statement>
    </statement-execution-processor>
</data-dictionary>
