<!--
  ~ Copyright 2024 Oracle and/or its affiliates
  ~
  ~ Licensed under the Apache License, Version 2.0 (the "License");
  ~ you may not use this file except in compliance with the License.
  ~ You may obtain a copy of the License at
  ~
  ~ https://www.apache.org/licenses/LICENSE-2.0
  ~
  ~ Unless required by applicable law or agreed to in writing, software
  ~ distributed under the License is distributed on an "AS IS" BASIS,
  ~ WITHOUT WARRANTIES OR CONDITIONS OF ANY KIND, either express or implied.
  ~ See the License for the specific language governing permissions and
  ~ limitations under the License.
  -->

<!DOCTYPE data-dictionary SYSTEM "../statement-interface.dtd">
<data-dictionary>
    <statement-execution-processor id="rename-table">
        <statement>alter table {@0}.{@1} rename to {@2}</statement>
    </statement-execution-processor>

    <statement-execution-processor id="rename-column">
        <statement>alter table {@0}.{@1} rename column {@2} to {@3}</statement>
    </statement-execution-processor>

    <statement-execution-processor id="create-view">
        <statement>create view [{0}] as {1}</statement>
    </statement-execution-processor>

    <statement-execution-processor id="create-object">
        <statement>create {0}</statement>
    </statement-execution-processor>

    <statement-execution-processor id="drop-object">
        <statement>drop {0} {2}</statement>
    </statement-execution-processor>

    <statement-execution-processor id="drop-user">
        <statement>drop user {@0}</statement>
    </statement-execution-processor>

    <statement-execution-processor id="drop-object-if-exists">
        <statement>drop {0} if exists {2}</statement>
    </statement-execution-processor>

    <statement-execution-processor id="get-session-sql-mode">
        <statement>SELECT @@session.sql_mode</statement>
    </statement-execution-processor>

    <statement-execution-processor id="set-session-sql-mode">
        <statement>SET sql_mode='{0}'</statement>
    </statement-execution-processor>
</data-dictionary>
